{"$schema":"https://json-schema.org/draft/2020-12/schema","title":"Interaction v3","type":"object","required":["schemaVersion","id","source","target","actions"],"properties":{"schemaVersion":{"const":3},"id":{"type":"string","minLength":1},"source":{"type":"object"},"target":{"type":"object"},"shapeTest":{"type":"string"},"priority":{"type":"integer"},"actions":{"type":"array","items":{"enum":["destroy-source","destroy-target","convert-target","reflect-target","emit-projectile-interaction","emit-projectile-cancelled","emit-laser-contact"]}},"convertProjectileId":{"type":["string","null"]}}}
